<?xml version="1.0"?>
<xs:schema xmlns:xs="http://www.w3.org/2001/XMLSchema" 
version="0.1" xml:lang="es">

  <xs:element name="BDcontactos">
    <xs:complexType>
      <xs:sequence>
        <xs:element name="contacto" maxOccurs="unbounded">
          <xs:complexType>
            <xs:sequence>
              <xs:element name="nombre" type="xs:string"/>
              <xs:element name="telefono" type="xs:string"/>
              <xs:element name="direccion" type="xs:string"/>
              <xs:element name="email" type="xs:string"/>
            </xs:sequence>
          </xs:complexType>
        </xs:element>
      </xs:sequence>
    </xs:complexType>
  </xs:element>
</xs:schema>
